{
  "meta": {
    "run_id": "sprint-mock-F1",
    "source": "mock",
    "unit": "flow-mock",
    "model": "mock",
    "date": "2026-10-12",
    "started_at": "2026-10-12T15:00:00.000Z",
    "ticket": "EPIC-RQ6",
    "condition": {},
    "outcome": "released",
    "ticket_done": null,
    "session_outcome": "success",
    "stage": "M2b",
    "title": "Sprint · EPIC-RQ6 Multi-currency checkout · F1",
    "scenario": "meridian-retail/M2-flow",
    "trace_sha256": "8eff6dfeb3c3bb8ce23d83556d8f2fef3a5250d22e23e522d6a88fa649a31a77",
    "schema": "replay/1",
    "exporter_version": 1,
    "legend": "SIMULATED (mock agent) — not a real run",
    "duration_ms": 308000,
    "duration_real_ms": 1337000,
    "event_count": 156
  },
  "places": [
    {
      "id": "product-desk",
      "label": "Product desk",
      "kind": "desk",
      "x": 0.1,
      "y": 0.2,
      "note": "discovery"
    },
    {
      "id": "planning-room",
      "label": "Planning room",
      "kind": "room",
      "x": 0.3,
      "y": 0.2,
      "note": "planning"
    },
    {
      "id": "architecture-library",
      "label": "Architecture library",
      "kind": "library",
      "x": 0.52,
      "y": 0.18,
      "note": "ARCH-n rules, catalog, ADRs"
    },
    {
      "id": "dispatch",
      "label": "Dispatch board",
      "kind": "system",
      "x": 0.8,
      "y": 0.18,
      "note": "flow engine"
    },
    {
      "id": "desk-orders",
      "label": "Checkout · orders",
      "kind": "desk",
      "x": 0.1,
      "y": 0.55,
      "note": "orders-service"
    },
    {
      "id": "desk-billing",
      "label": "Finance · billing",
      "kind": "desk",
      "x": 0.1,
      "y": 0.84,
      "note": "billing-service"
    },
    {
      "id": "desk-analytics",
      "label": "Data · analytics",
      "kind": "desk",
      "x": 0.3,
      "y": 0.84,
      "note": "analytics-ingest"
    },
    {
      "id": "desk-storefront",
      "label": "Digital · storefront",
      "kind": "desk",
      "x": 0.5,
      "y": 0.84,
      "note": "web-storefront"
    },
    {
      "id": "review-table",
      "label": "Review table",
      "kind": "room",
      "x": 0.36,
      "y": 0.53,
      "note": "pull request"
    },
    {
      "id": "ci-tower",
      "label": "CI Tower",
      "kind": "system",
      "x": 0.6,
      "y": 0.5,
      "note": "one light per check"
    },
    {
      "id": "merge-gate",
      "label": "Merge gate",
      "kind": "gate",
      "x": 0.84,
      "y": 0.5,
      "note": "merge"
    },
    {
      "id": "staging-bench",
      "label": "Staging bench",
      "kind": "stage",
      "x": 0.8,
      "y": 0.84,
      "note": "hidden from the agent"
    }
  ],
  "actors": [
    {
      "id": "flow-engine",
      "role": "flow_engine",
      "actor_type": "system",
      "display_name": "Flow engine",
      "avatar": {
        "style": "system",
        "seed": "flow-engine",
        "badge": null
      },
      "home": "dispatch"
    },
    {
      "id": "originator",
      "role": "originator",
      "actor_type": "human",
      "display_name": "Olivia · Originator (Sales)",
      "avatar": {
        "style": "human",
        "seed": "originator",
        "badge": null
      },
      "home": "product-desk",
      "simulated": true
    },
    {
      "id": "product-owner",
      "role": "product_owner",
      "actor_type": "human",
      "display_name": "Priya · Product Owner",
      "avatar": {
        "style": "human",
        "seed": "product-owner",
        "badge": null
      },
      "home": "product-desk",
      "simulated": true
    },
    {
      "id": "engineer",
      "role": "engineer",
      "actor_type": "human",
      "display_name": "Ethan · Engineer",
      "avatar": {
        "style": "human",
        "seed": "engineer",
        "badge": null
      },
      "home": "planning-room",
      "simulated": true
    },
    {
      "id": "tech-lead",
      "role": "tech_lead",
      "actor_type": "human",
      "display_name": "Tomás · Tech Lead",
      "avatar": {
        "style": "human",
        "seed": "tech-lead",
        "badge": null
      },
      "home": "planning-room",
      "simulated": true
    },
    {
      "id": "architect",
      "role": "architect",
      "actor_type": "human",
      "display_name": "Maya · Architect",
      "avatar": {
        "style": "human",
        "seed": "architect",
        "badge": null
      },
      "home": "architecture-library",
      "simulated": true
    },
    {
      "id": "requirements-agent",
      "role": "requirements_agent",
      "actor_type": "agent",
      "display_name": "Requirements Agent",
      "avatar": {
        "style": "agent",
        "seed": "requirements-agent",
        "badge": "Mock"
      },
      "home": "product-desk"
    },
    {
      "id": "task-planner",
      "role": "task_planner",
      "actor_type": "agent",
      "display_name": "Task Planner",
      "avatar": {
        "style": "agent",
        "seed": "task-planner",
        "badge": "Mock"
      },
      "home": "planning-room"
    },
    {
      "id": "code-storefront",
      "role": "code_agent",
      "actor_type": "agent",
      "display_name": "Code Agent · web-storefront",
      "avatar": {
        "style": "agent",
        "seed": "code-storefront",
        "badge": "Mock"
      },
      "home": "desk-storefront"
    },
    {
      "id": "code-orders",
      "role": "code_agent",
      "actor_type": "agent",
      "display_name": "Code Agent · orders-service",
      "avatar": {
        "style": "agent",
        "seed": "code-orders",
        "badge": "Mock"
      },
      "home": "desk-orders"
    },
    {
      "id": "code-payments",
      "role": "code_agent",
      "actor_type": "agent",
      "display_name": "Code Agent · payments-service",
      "avatar": {
        "style": "agent",
        "seed": "code-payments",
        "badge": "Mock"
      },
      "home": "desk-orders"
    },
    {
      "id": "code-billing",
      "role": "code_agent",
      "actor_type": "agent",
      "display_name": "Code Agent · billing-service",
      "avatar": {
        "style": "agent",
        "seed": "code-billing",
        "badge": "Mock"
      },
      "home": "desk-billing"
    },
    {
      "id": "code-analytics",
      "role": "code_agent",
      "actor_type": "agent",
      "display_name": "Code Agent · analytics-ingest",
      "avatar": {
        "style": "agent",
        "seed": "code-analytics",
        "badge": "Mock"
      },
      "home": "desk-analytics"
    },
    {
      "id": "code-inventory",
      "role": "code_agent",
      "actor_type": "agent",
      "display_name": "Code Agent · inventory-service",
      "avatar": {
        "style": "agent",
        "seed": "code-inventory",
        "badge": "Mock"
      },
      "home": "desk-orders"
    },
    {
      "id": "review-agent",
      "role": "review_agent",
      "actor_type": "agent",
      "display_name": "Review Agent",
      "avatar": {
        "style": "agent",
        "seed": "review-agent",
        "badge": "Mock"
      },
      "home": "review-table"
    },
    {
      "id": "verifier",
      "role": "verifier",
      "actor_type": "agent",
      "display_name": "Verifier",
      "avatar": {
        "style": "agent",
        "seed": "verifier",
        "badge": "Mock"
      },
      "home": "review-table"
    },
    {
      "id": "owner-storefront",
      "role": "code_owner",
      "actor_type": "human",
      "display_name": "Code Owner · web-storefront (Digital)",
      "avatar": {
        "style": "human",
        "seed": "owner-storefront",
        "badge": null
      },
      "home": "review-table",
      "simulated": true
    },
    {
      "id": "owner-orders",
      "role": "code_owner",
      "actor_type": "human",
      "display_name": "Code Owner · orders-service (Checkout)",
      "avatar": {
        "style": "human",
        "seed": "owner-orders",
        "badge": null
      },
      "home": "review-table",
      "simulated": true
    },
    {
      "id": "owner-billing",
      "role": "code_owner",
      "actor_type": "human",
      "display_name": "Code Owner · billing-service (Finance)",
      "avatar": {
        "style": "human",
        "seed": "owner-billing",
        "badge": null
      },
      "home": "review-table",
      "simulated": true
    },
    {
      "id": "owner-analytics",
      "role": "code_owner",
      "actor_type": "human",
      "display_name": "Code Owner · analytics-ingest (Data)",
      "avatar": {
        "style": "human",
        "seed": "owner-analytics",
        "badge": null
      },
      "home": "review-table",
      "simulated": true
    },
    {
      "id": "release-manager",
      "role": "release_manager",
      "actor_type": "human",
      "display_name": "Rosa · Release Manager",
      "avatar": {
        "style": "human",
        "seed": "release-manager",
        "badge": null
      },
      "home": "merge-gate",
      "simulated": true
    },
    {
      "id": "ci",
      "role": "ci",
      "actor_type": "system",
      "display_name": "CI",
      "avatar": {
        "style": "system",
        "seed": "ci",
        "badge": null
      },
      "home": "ci-tower"
    },
    {
      "id": "staging",
      "role": "staging",
      "actor_type": "system",
      "display_name": "Staging (oracle)",
      "avatar": {
        "style": "system",
        "seed": "staging",
        "badge": null
      },
      "home": "staging-bench"
    }
  ],
  "steps": [
    {
      "t_ms": 0,
      "t_real_ms": 0,
      "seq": 0,
      "actor": "flow-engine",
      "action": "phase",
      "target": null,
      "place": "dispatch",
      "text": "Sprint · EPIC-RQ6 Multi-currency checkout · F1",
      "key": null,
      "narration": null,
      "detail": {
        "event_type": "SESSION_STARTED",
        "event_id": "evt-0000",
        "phase": "discovery",
        "to_phase": "discovery",
        "scenario": "meridian-retail/M2-flow",
        "condition": ""
      }
    },